{
  "templateId": "2018142d-44f8-4e3b-8f09-04b12537ed91",
  "name": "New Custom Template",
  "schemaVersion": "1.0.0",
  "page": {
    "widthMm": 38.1,
    "heightMm": 101.6
  },
  "zones": {
    "printableTopMm": 0,
    "printableBottomMm": 50.8,
    "lockedTopMm": 50.8,
    "lockedBottomMm": 101.6
  },
  "elements": [],
  "metadata": {
    "createdAt": "2026-02-16T16:14:03.450Z",
    "updatedAt": "2026-02-16T16:14:11.108Z"
  }
}