{
  "templateId": "654e26c6-e3a4-4a6d-9676-5fee86ea4325",
  "name": "New Custom Template",
  "schemaVersion": "1.0.0",
  "page": {
    "widthMm": 38.1,
    "heightMm": 101.6
  },
  "zones": {
    "printableTopMm": 0,
    "printableBottomMm": 50.8,
    "lockedTopMm": 50.8,
    "lockedBottomMm": 101.6
  },
  "elements": [
    {
      "id": "32619be4-0d00-4cf7-9f27-066de8532383",
      "type": "variableText",
      "xMm": 4,
      "yMm": 16.51,
      "widthMm": 20,
      "heightMm": 6,
      "style": {
        "fill": "#000000",
        "stroke": "#000000",
        "strokeWidth": 0.4,
        "fontFamily": "Helvetica",
        "fontSizePt": 8,
        "fontWeight": "normal",
        "fontStyle": "normal",
        "textAlign": "left"
      },
      "binding": {
        "kind": "field",
        "value": "device.name",
        "fallback": "N/A"
      }
    },
    {
      "id": "6f9a2c3b-0a64-4d45-8786-5423ddf5375e",
      "type": "line",
      "xMm": 2,
      "yMm": 2,
      "widthMm": 18,
      "heightMm": 0.2,
      "style": {
        "fill": "#000000",
        "stroke": "#000000",
        "strokeWidth": 0.4,
        "fontFamily": "Helvetica",
        "fontSizePt": 8,
        "fontWeight": "normal",
        "fontStyle": "normal",
        "textAlign": "left"
      },
      "binding": {
        "kind": "static",
        "value": ""
      }
    },
    {
      "id": "b0236d44-5190-4d73-a048-f76c50c63ec9",
      "type": "line",
      "xMm": 2,
      "yMm": 2,
      "widthMm": 18,
      "heightMm": 0.2,
      "style": {
        "fill": "#000000",
        "stroke": "#000000",
        "strokeWidth": 0.4,
        "fontFamily": "Helvetica",
        "fontSizePt": 8,
        "fontWeight": "normal",
        "fontStyle": "normal",
        "textAlign": "left"
      },
      "binding": {
        "kind": "static",
        "value": ""
      }
    },
    {
      "id": "cf44be20-e678-4590-9c46-f44ea6582d36",
      "type": "rect",
      "xMm": 8.34,
      "yMm": 16.34,
      "widthMm": 14,
      "heightMm": 8,
      "style": {
        "fill": "#000000",
        "stroke": "#000000",
        "strokeWidth": 0.4,
        "fontFamily": "Helvetica",
        "fontSizePt": 8,
        "fontWeight": "normal",
        "fontStyle": "normal",
        "textAlign": "left"
      },
      "binding": {
        "kind": "static",
        "value": ""
      }
    },
    {
      "id": "e6b33830-dfec-44f2-9d18-5511c60ffc71",
      "type": "arrow",
      "xMm": 2,
      "yMm": 2,
      "widthMm": 16,
      "heightMm": 4,
      "style": {
        "fill": "#000000",
        "stroke": "#000000",
        "strokeWidth": 0.4,
        "fontFamily": "Helvetica",
        "fontSizePt": 8,
        "fontWeight": "normal",
        "fontStyle": "normal",
        "textAlign": "left"
      },
      "binding": {
        "kind": "static",
        "value": ""
      }
    },
    {
      "id": "906845a0-cc1b-4c50-b0e7-c2118b953822",
      "type": "arrow",
      "xMm": 2.02,
      "yMm": 8.56,
      "widthMm": 15.19,
      "heightMm": 18.1,
      "style": {
        "fill": "#000000",
        "stroke": "#000000",
        "strokeWidth": 0.4,
        "fontFamily": "Helvetica",
        "fontSizePt": 8,
        "fontWeight": "normal",
        "fontStyle": "normal",
        "textAlign": "left"
      },
      "binding": {
        "kind": "static",
        "value": ""
      }
    }
  ],
  "metadata": {
    "createdAt": "2026-02-16T16:14:21.253Z",
    "updatedAt": "2026-02-16T16:14:52.248Z"
  }
}